id,image,title,description,runtimeStr,genres,genreList,contentRating,imDbRating,imDbRatingVotes,metacriticRating,plot,stars,starListtt0107688,https://m.media-amazon.com/images/M/MV5BNWE4OTNiM2ItMjY4Ni00ZTViLWFiZmEtZGEyNGY2ZmNlMzIyXkEyXkFqcGdeQXVyMDU5NDcxNw@@._V1_Ratio0.6837_AL_.jpg,The Nightmare Before Christmas,(1993),76 min,"Animation, Family, Fantasy","[{'key': 'Animation', 'value': 'Animation'}, {'key': 'Family', 'value': 'Family'}, {'key': 'Fantasy', 'value': 'Fantasy'}]",PG,7.9,337096,82,"Jack Skellington, king of Halloween Town, discovers Christmas Town, but his attempts to bring Christmas to his home causes confusion.","Henry Selick, Danny Elfman, Chris Sarandon, Catherine O'Hara, William Hickey","[{'id': 'tt0107688', 'name': 'Henry Selick'}, {'id': 'tt0107688', 'name': 'Danny Elfman'}, {'id': 'tt0107688', 'name': 'Chris Sarandon'}, {'id': 'tt0107688', 'name': ""Catherine O'Hara""}, {'id': 'tt0107688', 'name': 'William Hickey'}]"
tt14668630,https://m.media-amazon.com/images/M/MV5BYjNhZjA3MTctOTFjNi00Mjg5LTk3ODctOGZkNDMyMjY3YWNhXkEyXkFqcGdeQXVyMTI2ODM1ODUw._V1_Ratio0.6837_AL_.jpg,"Lyle, Lyle, Crocodile",(2022),106 min,"Animation, Adventure, Comedy","[{'key': 'Animation', 'value': 'Animation'}, {'key': 'Adventure', 'value': 'Adventure'}, {'key': 'Comedy', 'value': 'Comedy'}]",PG,6.3,1960,51,Feature film based on the children's book about a crocodile that lives in New York City.,"Josh Gordon, Will Speck, Javier Bardem, Constance Wu, Scoot McNairy, Brett Gelman","[{'id': 'tt14668630', 'name': 'Josh Gordon'}, {'id': 'tt14668630', 'name': 'Will Speck'}, {'id': 'tt14668630', 'name': 'Javier Bardem'}, {'id': 'tt14668630', 'name': 'Constance Wu'}, {'id': 'tt14668630', 'name': 'Scoot McNairy'}, {'id': 'tt14668630', 'name': 'Brett Gelman'}]"
tt8912936,https://m.media-amazon.com/images/M/MV5BZTIyNzc3NzMtNGE5YS00Yjg5LTk5MDMtOTUxMzk1ZTBkOTgwXkEyXkFqcGdeQXVyODE5NzE3OTE@._V1_Ratio0.6837_AL_.jpg,DC League of Super-Pets,(2022),105 min,"Animation, Action, Adventure","[{'key': 'Animation', 'value': 'Animation'}, {'key': 'Action', 'value': 'Action'}, {'key': 'Adventure', 'value': 'Adventure'}]",PG,7.3,59134,56,"Krypto the Super-Dog and Superman are inseparable best friends, sharing the same superpowers and fighting crime side by side in Metropolis. However, Krypto must master his own powers for a rescue mission when Superman is kidnapped.","Jared Stern, Sam J. Levine, Dwayne Johnson, Kevin Hart, Kate McKinnon, John Krasinski","[{'id': 'tt8912936', 'name': 'Jared Stern'}, {'id': 'tt8912936', 'name': 'Sam J. Levine'}, {'id': 'tt8912936', 'name': 'Dwayne Johnson'}, {'id': 'tt8912936', 'name': 'Kevin Hart'}, {'id': 'tt8912936', 'name': 'Kate McKinnon'}, {'id': 'tt8912936', 'name': 'John Krasinski'}]"
tt3704428,https://m.media-amazon.com/images/M/MV5BYzMzNTJjYmMtZTkxNS00MjI4LWI3YmQtOTQ4MDZjZDJlZjQyXkEyXkFqcGdeQXVyNjc0NzQzNTM@._V1_Ratio0.6837_AL_.jpg,Elvis,(2022),159 min,"Biography, Drama, Music","[{'key': 'Biography', 'value': 'Biography'}, {'key': 'Drama', 'value': 'Drama'}, {'key': 'Music', 'value': 'Music'}]",PG-13,7.4,140203,64,"The life of American music icon Elvis Presley, from his childhood to becoming a rock and movie star in the 1950s while maintaining a complex relationship with his manager, Colonel Tom Parker.","Baz Luhrmann, Tom Hanks, Austin Butler, Olivia DeJonge, Helen Thomson","[{'id': 'tt3704428', 'name': 'Baz Luhrmann'}, {'id': 'tt3704428', 'name': 'Tom Hanks'}, {'id': 'tt3704428', 'name': 'Austin Butler'}, {'id': 'tt3704428', 'name': 'Olivia DeJonge'}, {'id': 'tt3704428', 'name': 'Helen Thomson'}]"
tt14444726,https://m.media-amazon.com/images/M/MV5BM2I0ZDcyYzItMGEyNi00YWVhLTlmNTQtOWVlYjE1ZGVhNWM0XkEyXkFqcGdeQXVyMTkxNjUyNQ@@._V1_Ratio0.6837_AL_.jpg,Tár,(2022),158 min,"Drama, Music","[{'key': 'Drama', 'value': 'Drama'}, {'key': 'Music', 'value': 'Music'}]",R,8.2,2813,91,"Set in the international world of Western classical music, the film centers on Lydia Tár, widely considered one of the greatest living composer-conductors and first-ever female music director of a major German orchestra.","Todd Field, Cate Blanchett, Noémie Merlant, Nina Hoss, Sophie Kauer","[{'id': 'tt14444726', 'name': 'Todd Field'}, {'id': 'tt14444726', 'name': 'Cate Blanchett'}, {'id': 'tt14444726', 'name': 'Noémie Merlant'}, {'id': 'tt14444726', 'name': 'Nina Hoss'}, {'id': 'tt14444726', 'name': 'Sophie Kauer'}]"
tt14444726,https://m.media-amazon.com/images/M/MV5BM2I0ZDcyYzItMGEyNi00YWVhLTlmNTQtOWVlYjE1ZGVhNWM0XkEyXkFqcGdeQXVyMTkxNjUyNQ@@._V1_Ratio0.6837_AL_.jpg,Tár,(2022),158 min,"Drama, Music","[{'key': 'Drama', 'value': 'Drama'}, {'key': 'Music', 'value': 'Music'}]",R,8.2,2813,91,"Set in the international world of Western classical music, the film centers on Lydia Tár, widely considered one of the greatest living composer-conductors and first-ever female music director of a major German orchestra.","Todd Field, Cate Blanchett, Noémie Merlant, Nina Hoss, Sophie Kauer","[{'id': 'tt14444726', 'name': 'Todd Field'}, {'id': 'tt14444726', 'name': 'Cate Blanchett'}, {'id': 'tt14444726', 'name': 'Noémie Merlant'}, {'id': 'tt14444726', 'name': 'Nina Hoss'}, {'id': 'tt14444726', 'name': 'Sophie Kauer'}]"
tt3704428,https://m.media-amazon.com/images/M/MV5BYzMzNTJjYmMtZTkxNS00MjI4LWI3YmQtOTQ4MDZjZDJlZjQyXkEyXkFqcGdeQXVyNjc0NzQzNTM@._V1_Ratio0.6837_AL_.jpg,Elvis,(2022),159 min,"Biography, Drama, Music","[{'key': 'Biography', 'value': 'Biography'}, {'key': 'Drama', 'value': 'Drama'}, {'key': 'Music', 'value': 'Music'}]",PG-13,7.4,140203,64,"The life of American music icon Elvis Presley, from his childhood to becoming a rock and movie star in the 1950s while maintaining a complex relationship with his manager, Colonel Tom Parker.","Baz Luhrmann, Tom Hanks, Austin Butler, Olivia DeJonge, Helen Thomson","[{'id': 'tt3704428', 'name': 'Baz Luhrmann'}, {'id': 'tt3704428', 'name': 'Tom Hanks'}, {'id': 'tt3704428', 'name': 'Austin Butler'}, {'id': 'tt3704428', 'name': 'Olivia DeJonge'}, {'id': 'tt3704428', 'name': 'Helen Thomson'}]"
tt15301048,https://m.media-amazon.com/images/M/MV5BMjhiYzUwZTYtYzU2MC00N2UwLTkwNmMtMGI1MTZjYzljNDZjXkEyXkFqcGdeQXVyNjk1Njg5NTA@._V1_Ratio0.6837_AL_.jpg,"Argentina, 1985",(2022),140 min,"Biography, Crime, Drama","[{'key': 'Biography', 'value': 'Biography'}, {'key': 'Crime', 'value': 'Crime'}, {'key': 'Drama', 'value': 'Drama'}]",R,7.9,5540,78,A team of lawyers takes on the heads of Argentina's bloody military dictatorship during the 1980s in a battle against odds and a race against time.,"Santiago Mitre, Ricardo Darín, Gina Mastronicola, Francisco Bertín, Santiago Armas Estevarena","[{'id': 'tt15301048', 'name': 'Santiago Mitre'}, {'id': 'tt15301048', 'name': 'Ricardo Darín'}, {'id': 'tt15301048', 'name': 'Gina Mastronicola'}, {'id': 'tt15301048', 'name': 'Francisco Bertín'}, {'id': 'tt15301048', 'name': 'Santiago Armas Estevarena'}]"
tt1655389,https://m.media-amazon.com/images/M/MV5BNDk2YTA1MGYtMGNjMi00YTJlLWI1YjItMjBjOGJlZGIwZmYzXkEyXkFqcGdeQXVyODA0MjgyNzM@._V1_Ratio0.6837_AL_.jpg,Blonde,(2022),167 min,"Biography, Drama, Romance","[{'key': 'Biography', 'value': 'Biography'}, {'key': 'Drama', 'value': 'Drama'}, {'key': 'Romance', 'value': 'Romance'}]",NC-17,5.5,46191,50,A fictionalized chronicle of the inner life of Marilyn Monroe.,"Andrew Dominik, Ana de Armas, Lily Fisher, Julianne Nicholson, Tygh Runyan","[{'id': 'tt1655389', 'name': 'Andrew Dominik'}, {'id': 'tt1655389', 'name': 'Ana de Armas'}, {'id': 'tt1655389', 'name': 'Lily Fisher'}, {'id': 'tt1655389', 'name': 'Julianne Nicholson'}, {'id': 'tt1655389', 'name': 'Tygh Runyan'}]"
tt3704428,https://m.media-amazon.com/images/M/MV5BYzMzNTJjYmMtZTkxNS00MjI4LWI3YmQtOTQ4MDZjZDJlZjQyXkEyXkFqcGdeQXVyNjc0NzQzNTM@._V1_Ratio0.6837_AL_.jpg,Elvis,(2022),159 min,"Biography, Drama, Music","[{'key': 'Biography', 'value': 'Biography'}, {'key': 'Drama', 'value': 'Drama'}, {'key': 'Music', 'value': 'Music'}]",PG-13,7.4,140203,64,"The life of American music icon Elvis Presley, from his childhood to becoming a rock and movie star in the 1950s while maintaining a complex relationship with his manager, Colonel Tom Parker.","Baz Luhrmann, Tom Hanks, Austin Butler, Olivia DeJonge, Helen Thomson","[{'id': 'tt3704428', 'name': 'Baz Luhrmann'}, {'id': 'tt3704428', 'name': 'Tom Hanks'}, {'id': 'tt3704428', 'name': 'Austin Butler'}, {'id': 'tt3704428', 'name': 'Olivia DeJonge'}, {'id': 'tt3704428', 'name': 'Helen Thomson'}]"
tt3704428,https://m.media-amazon.com/images/M/MV5BYzMzNTJjYmMtZTkxNS00MjI4LWI3YmQtOTQ4MDZjZDJlZjQyXkEyXkFqcGdeQXVyNjc0NzQzNTM@._V1_Ratio0.6837_AL_.jpg,Elvis,(2022),159 min,"Biography, Drama, Music","[{'key': 'Biography', 'value': 'Biography'}, {'key': 'Drama', 'value': 'Drama'}, {'key': 'Music', 'value': 'Music'}]",PG-13,7.4,140203,64,"The life of American music icon Elvis Presley, from his childhood to becoming a rock and movie star in the 1950s while maintaining a complex relationship with his manager, Colonel Tom Parker.","Baz Luhrmann, Tom Hanks, Austin Butler, Olivia DeJonge, Helen Thomson","[{'id': 'tt3704428', 'name': 'Baz Luhrmann'}, {'id': 'tt3704428', 'name': 'Tom Hanks'}, {'id': 'tt3704428', 'name': 'Austin Butler'}, {'id': 'tt3704428', 'name': 'Olivia DeJonge'}, {'id': 'tt3704428', 'name': 'Helen Thomson'}]"
tt1655389,https://m.media-amazon.com/images/M/MV5BNDk2YTA1MGYtMGNjMi00YTJlLWI1YjItMjBjOGJlZGIwZmYzXkEyXkFqcGdeQXVyODA0MjgyNzM@._V1_Ratio0.6837_AL_.jpg,Blonde,(2022),167 min,"Biography, Drama, Romance","[{'key': 'Biography', 'value': 'Biography'}, {'key': 'Drama', 'value': 'Drama'}, {'key': 'Romance', 'value': 'Romance'}]",NC-17,5.5,46191,50,A fictionalized chronicle of the inner life of Marilyn Monroe.,"Andrew Dominik, Ana de Armas, Lily Fisher, Julianne Nicholson, Tygh Runyan","[{'id': 'tt1655389', 'name': 'Andrew Dominik'}, {'id': 'tt1655389', 'name': 'Ana de Armas'}, {'id': 'tt1655389', 'name': 'Lily Fisher'}, {'id': 'tt1655389', 'name': 'Julianne Nicholson'}, {'id': 'tt1655389', 'name': 'Tygh Runyan'}]"
tt15301048,https://m.media-amazon.com/images/M/MV5BMjhiYzUwZTYtYzU2MC00N2UwLTkwNmMtMGI1MTZjYzljNDZjXkEyXkFqcGdeQXVyNjk1Njg5NTA@._V1_Ratio0.6837_AL_.jpg,"Argentina, 1985",(2022),140 min,"Biography, Crime, Drama","[{'key': 'Biography', 'value': 'Biography'}, {'key': 'Crime', 'value': 'Crime'}, {'key': 'Drama', 'value': 'Drama'}]",R,7.9,5540,78,A team of lawyers takes on the heads of Argentina's bloody military dictatorship during the 1980s in a battle against odds and a race against time.,"Santiago Mitre, Ricardo Darín, Gina Mastronicola, Francisco Bertín, Santiago Armas Estevarena","[{'id': 'tt15301048', 'name': 'Santiago Mitre'}, {'id': 'tt15301048', 'name': 'Ricardo Darín'}, {'id': 'tt15301048', 'name': 'Gina Mastronicola'}, {'id': 'tt15301048', 'name': 'Francisco Bertín'}, {'id': 'tt15301048', 'name': 'Santiago Armas Estevarena'}]"
tt7405458,https://m.media-amazon.com/images/M/MV5BNzg3OTEzMTgtYWU0OC00YTI0LWIxOTAtNmRkNTc0Nzg2YWU1XkEyXkFqcGdeQXVyNjY1MTg4Mzc@._V1_Ratio0.7857_AL_.jpg,A Man Called Otto,(2022),,"Comedy, Drama","[{'key': 'Comedy', 'value': 'Comedy'}, {'key': 'Drama', 'value': 'Drama'}]",,,,,,,
tt0144084,https://m.media-amazon.com/images/M/MV5BZTM2ZGJmNjQtN2UyOS00NjcxLWFjMDktMDE2NzMyNTZlZTBiXkEyXkFqcGdeQXVyNzkwMjQ5NzM@._V1_Ratio0.6837_AL_.jpg,American Psycho,(2000),102 min,"Crime, Drama, Horror","[{'key': 'Crime', 'value': 'Crime'}, {'key': 'Drama', 'value': 'Drama'}, {'key': 'Horror', 'value': 'Horror'}]",R,7.6,608343,64,"A wealthy New York City investment banking executive, Patrick Bateman, hides his alternate psychopathic ego from his co-workers and friends as he delves deeper into his violent, hedonistic fantasies.","Mary Harron, Christian Bale, Justin Theroux, Josh Lucas, Bill Sage","[{'id': 'tt0144084', 'name': 'Mary Harron'}, {'id': 'tt0144084', 'name': 'Christian Bale'}, {'id': 'tt0144084', 'name': 'Justin Theroux'}, {'id': 'tt0144084', 'name': 'Josh Lucas'}, {'id': 'tt0144084', 'name': 'Bill Sage'}]"
tt10304142,https://m.media-amazon.com/images/M/MV5BNDQwNzE0ZTItYmZjMC00NjI3LWFlNzctNTExZDY2NWE0Zjc0XkEyXkFqcGdeQXVyMTA3MDk2NDg2._V1_Ratio0.6837_AL_.jpg,Amsterdam,(2022),134 min,"Comedy, Drama, History","[{'key': 'Comedy', 'value': 'Comedy'}, {'key': 'Drama', 'value': 'Drama'}, {'key': 'History', 'value': 'History'}]",R,6.2,13809,48,"In the 1930s, three friends witness a murder, are framed for it, and uncover one of the most outrageous plots in American history.","David O. Russell, Christian Bale, Margot Robbie, John David Washington, Alessandro Nivola","[{'id': 'tt10304142', 'name': 'David O. Russell'}, {'id': 'tt10304142', 'name': 'Christian Bale'}, {'id': 'tt10304142', 'name': 'Margot Robbie'}, {'id': 'tt10304142', 'name': 'John David Washington'}, {'id': 'tt10304142', 'name': 'Alessandro Nivola'}]"
tt15301048,https://m.media-amazon.com/images/M/MV5BMjhiYzUwZTYtYzU2MC00N2UwLTkwNmMtMGI1MTZjYzljNDZjXkEyXkFqcGdeQXVyNjk1Njg5NTA@._V1_Ratio0.6837_AL_.jpg,"Argentina, 1985",(2022),140 min,"Biography, Crime, Drama","[{'key': 'Biography', 'value': 'Biography'}, {'key': 'Crime', 'value': 'Crime'}, {'key': 'Drama', 'value': 'Drama'}]",R,7.9,5540,78,A team of lawyers takes on the heads of Argentina's bloody military dictatorship during the 1980s in a battle against odds and a race against time.,"Santiago Mitre, Ricardo Darín, Gina Mastronicola, Francisco Bertín, Santiago Armas Estevarena","[{'id': 'tt15301048', 'name': 'Santiago Mitre'}, {'id': 'tt15301048', 'name': 'Ricardo Darín'}, {'id': 'tt15301048', 'name': 'Gina Mastronicola'}, {'id': 'tt15301048', 'name': 'Francisco Bertín'}, {'id': 'tt15301048', 'name': 'Santiago Armas Estevarena'}]"
tt10343028,https://m.media-amazon.com/images/M/MV5BZTM2MjllODItN2I2Mi00MmEzLTg3MmQtNTdmMjJiYzE2MTI3XkEyXkFqcGdeQXVyMTAxNzQ1NzI@._V1_Ratio0.6837_AL_.jpg,Armageddon Time,(2022),115 min,Drama,"[{'key': 'Drama', 'value': 'Drama'}]",R,6.9,796,75,A deeply personal coming-of-age story about the strength of family and the generational pursuit of the American Dream.,"James Gray, Anne Hathaway, Jeremy Strong, Banks Repeta, Jaylin Webb","[{'id': 'tt10343028', 'name': 'James Gray'}, {'id': 'tt10343028', 'name': 'Anne Hathaway'}, {'id': 'tt10343028', 'name': 'Jeremy Strong'}, {'id': 'tt10343028', 'name': 'Banks Repeta'}, {'id': 'tt10343028', 'name': 'Jaylin Webb'}]"
tt14176542,https://m.media-amazon.com/images/M/MV5BNmI5YjI5MmEtMTIyZS00OTQ2LWIwOTctMDM3OTAwNDAxZWFhXkEyXkFqcGdeQXVyNzA3ODUyNzY@._V1_Ratio0.6837_AL_.jpg,Bardo: False Chronicle of a Handful of Truths,(2022),159 min,"Comedy, Drama","[{'key': 'Comedy', 'value': 'Comedy'}, {'key': 'Drama', 'value': 'Drama'}]",R,7.4,861,51,"An acclaimed journalist-turned-documentarian goes on an oneiric introspective journey to reconcile with the past, the present and his Mexican identity.","Alejandro G. Iñárritu, Daniel Giménez Cacho, Griselda Siciliani, Ximena Lamadrid, Íker Sánchez Solano","[{'id': 'tt14176542', 'name': 'Alejandro G. Iñárritu'}, {'id': 'tt14176542', 'name': 'Daniel Giménez Cacho'}, {'id': 'tt14176542', 'name': 'Griselda Siciliani'}, {'id': 'tt14176542', 'name': 'Ximena Lamadrid'}, {'id': 'tt14176542', 'name': 'Íker Sánchez Solano'}]"
tt12610794,https://m.media-amazon.com/images/M/MV5BY2RkNWM0OWQtYmQxYi00ZjdlLTg4ZWItYTgwNjdlYzVlZjFmXkEyXkFqcGdeQXVyNjQ2MjQ4MzQ@._V1_Ratio0.6837_AL_.jpg,Blade of the 47 Ronin,(2022),107 min,"Action, Drama, Fantasy","[{'key': 'Action', 'value': 'Action'}, {'key': 'Drama', 'value': 'Drama'}, {'key': 'Fantasy', 'value': 'Fantasy'}]",R,4.6,463,,"Ancient Japanese Ronin warriors set 300 years after 47 Ronin, in a modern-day world where Samurai clans exist in complete secrecy.","Ron Yuan, Anna Akana, Teresa Ting, Mike Moh, Dustin Nguyen","[{'id': 'tt12610794', 'name': 'Ron Yuan'}, {'id': 'tt12610794', 'name': 'Anna Akana'}, {'id': 'tt12610794', 'name': 'Teresa Ting'}, {'id': 'tt12610794', 'name': 'Mike Moh'}, {'id': 'tt12610794', 'name': 'Dustin Nguyen'}]"
tt1655389,https://m.media-amazon.com/images/M/MV5BNDk2YTA1MGYtMGNjMi00YTJlLWI1YjItMjBjOGJlZGIwZmYzXkEyXkFqcGdeQXVyODA0MjgyNzM@._V1_Ratio0.6837_AL_.jpg,Blonde,(2022),167 min,"Biography, Drama, Romance","[{'key': 'Biography', 'value': 'Biography'}, {'key': 'Drama', 'value': 'Drama'}, {'key': 'Romance', 'value': 'Romance'}]",NC-17,5.5,46191,50,A fictionalized chronicle of the inner life of Marilyn Monroe.,"Andrew Dominik, Ana de Armas, Lily Fisher, Julianne Nicholson, Tygh Runyan","[{'id': 'tt1655389', 'name': 'Andrew Dominik'}, {'id': 'tt1655389', 'name': 'Ana de Armas'}, {'id': 'tt1655389', 'name': 'Lily Fisher'}, {'id': 'tt1655389', 'name': 'Julianne Nicholson'}, {'id': 'tt1655389', 'name': 'Tygh Runyan'}]"
tt11145118,https://m.media-amazon.com/images/M/MV5BZDNlZmRkM2UtZTBiYy00YTlhLThkZmEtM2YwY2FkMTUwZjViXkEyXkFqcGdeQXVyMTMzNDE5NDM2._V1_Ratio0.6837_AL_.jpg,Creed III,(2023),,"Drama, Sport","[{'key': 'Drama', 'value': 'Drama'}, {'key': 'Sport', 'value': 'Sport'}]",,,,,,,
tt3704428,https://m.media-amazon.com/images/M/MV5BYzMzNTJjYmMtZTkxNS00MjI4LWI3YmQtOTQ4MDZjZDJlZjQyXkEyXkFqcGdeQXVyNjc0NzQzNTM@._V1_Ratio0.6837_AL_.jpg,Elvis,(2022),159 min,"Biography, Drama, Music","[{'key': 'Biography', 'value': 'Biography'}, {'key': 'Drama', 'value': 'Drama'}, {'key': 'Music', 'value': 'Music'}]",PG-13,7.4,140203,64,"The life of American music icon Elvis Presley, from his childhood to becoming a rock and movie star in the 1950s while maintaining a complex relationship with his manager, Colonel Tom Parker.","Baz Luhrmann, Tom Hanks, Austin Butler, Olivia DeJonge, Helen Thomson","[{'id': 'tt3704428', 'name': 'Baz Luhrmann'}, {'id': 'tt3704428', 'name': 'Tom Hanks'}, {'id': 'tt3704428', 'name': 'Austin Butler'}, {'id': 'tt3704428', 'name': 'Olivia DeJonge'}, {'id': 'tt3704428', 'name': 'Helen Thomson'}]"
tt11564570,https://m.media-amazon.com/images/M/MV5BYmZlZDZkZjYtNzE5Mi00ODFhLTk2OTgtZWVmODBiZTI4NGFiXkEyXkFqcGdeQXVyMTE5MTg5NDIw._V1_Ratio0.6837_AL_.jpg,Glass Onion: A Knives Out Mystery,(2022),139 min,"Comedy, Crime, Drama","[{'key': 'Comedy', 'value': 'Comedy'}, {'key': 'Crime', 'value': 'Crime'}, {'key': 'Drama', 'value': 'Drama'}]",PG-13,8.1,1190,81,Famed Southern detective Benoit Blanc travels to Greece for his latest case.,"Rian Johnson, Daniel Craig, Edward Norton, Kate Hudson, Dave Bautista","[{'id': 'tt11564570', 'name': 'Rian Johnson'}, {'id': 'tt11564570', 'name': 'Daniel Craig'}, {'id': 'tt11564570', 'name': 'Edward Norton'}, {'id': 'tt11564570', 'name': 'Kate Hudson'}, {'id': 'tt11564570', 'name': 'Dave Bautista'}]"
tt17196124,https://m.media-amazon.com/images/M/MV5BNWJiMGFmMzItMjdhZi00OWQ2LThiYTgtZjgxZTY5NDkyZjIzXkEyXkFqcGdeQXVyNzQ2OTEzMzY@._V1_Ratio0.7857_AL_.jpg,Grimcutty,(2022),101 min,"Drama, Horror, Mystery","[{'key': 'Drama', 'value': 'Drama'}, {'key': 'Horror', 'value': 'Horror'}, {'key': 'Mystery', 'value': 'Mystery'}]",TV-MA,4.3,4380,,A suburban teen girl and her little brother must stop a terrifying internet meme brought to life by the hysteria of their parents.,"John Ross, Shannyn Sossamon, Sara Wolfkind, Usman Ally, Callan Farris","[{'id': 'tt17196124', 'name': 'John Ross'}, {'id': 'tt17196124', 'name': 'Shannyn Sossamon'}, {'id': 'tt17196124', 'name': 'Sara Wolfkind'}, {'id': 'tt17196124', 'name': 'Usman Ally'}, {'id': 'tt17196124', 'name': 'Callan Farris'}]"
tt12477480,https://m.media-amazon.com/images/M/MV5BOTEzYTljMTMtODU0ZC00ZWI0LTlhOGEtYjE3MjI3NTI1YmNhXkEyXkFqcGdeQXVyNjgxODk1MTM@._V1_Ratio0.6837_AL_.jpg,Decision to Leave,(2022),139 min,"Crime, Drama, Mystery","[{'key': 'Crime', 'value': 'Crime'}, {'key': 'Drama', 'value': 'Drama'}, {'key': 'Mystery', 'value': 'Mystery'}]",18,7.3,12631,84,A detective investigating a man's death in the mountains meets the dead man's mysterious wife in the course of his dogged sleuthing.,"Park Chan-wook, Park Hae-il, Tang Wei, Lee Jung-hyun, Go Kyung-Pyo","[{'id': 'tt12477480', 'name': 'Park Chan-wook'}, {'id': 'tt12477480', 'name': 'Park Hae-il'}, {'id': 'tt12477480', 'name': 'Tang Wei'}, {'id': 'tt12477480', 'name': 'Lee Jung-hyun'}, {'id': 'tt12477480', 'name': 'Go Kyung-Pyo'}]"
tt7784604,https://m.media-amazon.com/images/M/MV5BOTU5MDg3OGItZWQ1Ny00ZGVmLTg2YTUtMzBkYzQ1YWIwZjlhXkEyXkFqcGdeQXVyNTAzMTY4MDA@._V1_Ratio0.6837_AL_.jpg,Hereditary,(2018),127 min,"Drama, Horror, Mystery","[{'key': 'Drama', 'value': 'Drama'}, {'key': 'Horror', 'value': 'Horror'}, {'key': 'Mystery', 'value': 'Mystery'}]",R,7.3,312694,87,A grieving family is haunted by tragic and disturbing occurrences.,"Ari Aster, Toni Collette, Milly Shapiro, Gabriel Byrne, Alex Wolff","[{'id': 'tt7784604', 'name': 'Ari Aster'}, {'id': 'tt7784604', 'name': 'Toni Collette'}, {'id': 'tt7784604', 'name': 'Milly Shapiro'}, {'id': 'tt7784604', 'name': 'Gabriel Byrne'}, {'id': 'tt7784604', 'name': 'Alex Wolff'}]"
tt0816692,https://m.media-amazon.com/images/M/MV5BZjdkOTU3MDktN2IxOS00OGEyLWFmMjktY2FiMmZkNWIyODZiXkEyXkFqcGdeQXVyMTMxODk2OTU@._V1_Ratio0.6837_AL_.jpg,Interstellar,(2014),169 min,"Adventure, Drama, Sci-Fi","[{'key': 'Adventure', 'value': 'Adventure'}, {'key': 'Drama', 'value': 'Drama'}, {'key': 'Sci-Fi', 'value': 'Sci-Fi'}]",PG-13,8.6,1801958,74,A team of explorers travel through a wormhole in space in an attempt to ensure humanity's survival.,"Christopher Nolan, Matthew McConaughey, Anne Hathaway, Jessica Chastain, Mackenzie Foy","[{'id': 'tt0816692', 'name': 'Christopher Nolan'}, {'id': 'tt0816692', 'name': 'Matthew McConaughey'}, {'id': 'tt0816692', 'name': 'Anne Hathaway'}, {'id': 'tt0816692', 'name': 'Jessica Chastain'}, {'id': 'tt0816692', 'name': 'Mackenzie Foy'}]"
tt11315808,https://m.media-amazon.com/images/M/MV5BOTNlM2E1YTYtYmUzZS00MWZhLTk3OGEtNDRlOGUxMDhkODdlXkEyXkFqcGdeQXVyNDk4NzAyNzU@._V1_Ratio0.8061_AL_.jpg,Joker: Folie à Deux,(2024),,"Action, Crime, Drama","[{'key': 'Action', 'value': 'Action'}, {'key': 'Crime', 'value': 'Crime'}, {'key': 'Drama', 'value': 'Drama'}]",,,,,,,
tt5315210,https://m.media-amazon.com/images/M/MV5BYzdjMDViYTktM2QyZS00ZGNmLWFlMTctYTliZTUwMWM3YTMwXkEyXkFqcGdeQXVyMTE5MTg5NDIw._V1_Ratio0.6837_AL_.jpg,Lou,(I) (2022),107 min,"Action, Crime, Drama","[{'key': 'Action', 'value': 'Action'}, {'key': 'Crime', 'value': 'Crime'}, {'key': 'Drama', 'value': 'Drama'}]",R,6.1,20371,51,"A storm rages. A young girl is kidnapped. Her mother teams up with the mysterious woman next door to pursue the kidnapper, a journey that tests their limits and exposes shocking secrets from their pasts.","Anna Foerster, Allison Janney, Jurnee Smollett, Logan Marshall-Green, Ridley Asha Bateman","[{'id': 'tt5315210', 'name': 'Anna Foerster'}, {'id': 'tt5315210', 'name': 'Allison Janney'}, {'id': 'tt5315210', 'name': 'Jurnee Smollett'}, {'id': 'tt5315210', 'name': 'Logan Marshall-Green'}, {'id': 'tt5315210', 'name': 'Ridley Asha Bateman'}]"
tt8772262,https://m.media-amazon.com/images/M/MV5BMzQxNzQzOTQwM15BMl5BanBnXkFtZTgwMDQ2NTcwODM@._V1_Ratio0.6837_AL_.jpg,Midsommar,(2019),148 min,"Drama, Horror, Mystery","[{'key': 'Drama', 'value': 'Drama'}, {'key': 'Horror', 'value': 'Horror'}, {'key': 'Mystery', 'value': 'Mystery'}]",R,7.1,316441,72,A couple travels to Northern Europe to visit a rural hometown's fabled Swedish mid-summer festival. What begins as an idyllic retreat quickly devolves into an increasingly violent and bizarre competition at the hands of a pagan cult.,"Ari Aster, Florence Pugh, Jack Reynor, Vilhelm Blomgren, William Jackson Harper","[{'id': 'tt8772262', 'name': 'Ari Aster'}, {'id': 'tt8772262', 'name': 'Florence Pugh'}, {'id': 'tt8772262', 'name': 'Jack Reynor'}, {'id': 'tt8772262', 'name': 'Vilhelm Blomgren'}, {'id': 'tt8772262', 'name': 'William Jackson Harper'}]"
tt12908110,https://m.media-amazon.com/images/M/MV5BMmY3NGYzZGUtZDJjMS00NmI1LTgzY2ItODEyODcxNmI5MzkxXkEyXkFqcGdeQXVyODE5NzE3OTE@._V1_Ratio0.6837_AL_.jpg,Mr. Harrigan's Phone,(2022),104 min,"Drama, Horror, Mystery","[{'key': 'Drama', 'value': 'Drama'}, {'key': 'Horror', 'value': 'Horror'}, {'key': 'Mystery', 'value': 'Mystery'}]",PG-13,6.0,22653,55,"When Mr. Harrigan dies, Craig, the teen who befriended and did odd jobs for him, puts his smart phone in his pocket before burial. When the lonely youth sends his dead friend a message, he is shocked to get a return text.","John Lee Hancock, Donald Sutherland, Jaeden Martell, Joe Tippett, Colin O'Brien","[{'id': 'tt12908110', 'name': 'John Lee Hancock'}, {'id': 'tt12908110', 'name': 'Donald Sutherland'}, {'id': 'tt12908110', 'name': 'Jaeden Martell'}, {'id': 'tt12908110', 'name': 'Joe Tippett'}, {'id': 'tt12908110', 'name': ""Colin O'Brien""}]"
tt13139228,https://m.media-amazon.com/images/M/MV5BOTczM2JhOGMtMmQzOC00ZjgwLTlhNDEtMzU3NDRmMTQzMjM4XkEyXkFqcGdeQXVyMDM2NDM2MQ@@._V1_Ratio0.6837_AL_.jpg,My Policeman,(2022),113 min,"Drama, Romance","[{'key': 'Drama', 'value': 'Drama'}, {'key': 'Romance', 'value': 'Romance'}]",R,6.2,1063,49,The arrival of Patrick into Marion and Tom's home triggers the exploration of seismic events from 40 years previously.,"Michael Grandage, Harry Styles, Emma Corrin, Gina McKee, Linus Roache","[{'id': 'tt13139228', 'name': 'Michael Grandage'}, {'id': 'tt13139228', 'name': 'Harry Styles'}, {'id': 'tt13139228', 'name': 'Emma Corrin'}, {'id': 'tt13139228', 'name': 'Gina McKee'}, {'id': 'tt13139228', 'name': 'Linus Roache'}]"
tt11866324,https://m.media-amazon.com/images/M/MV5BMDBlMDYxMDktOTUxMS00MjcxLWE2YjQtNjNhMjNmN2Y3ZDA1XkEyXkFqcGdeQXVyMTM1MTE1NDMx._V1_Ratio0.6837_AL_.jpg,Prey,(I) (2022),99 min,"Action, Adventure, Drama","[{'key': 'Action', 'value': 'Action'}, {'key': 'Adventure', 'value': 'Adventure'}, {'key': 'Drama', 'value': 'Drama'}]",R,7.2,179082,71,"Naru, a skilled warrior of the Comanche Nation, fights to protect her tribe against one of the first highly-evolved Predators to land on Earth.","Dan Trachtenberg, Amber Midthunder, Dakota Beavers, Dane DiLiegro, Stormee Kipp","[{'id': 'tt11866324', 'name': 'Dan Trachtenberg'}, {'id': 'tt11866324', 'name': 'Amber Midthunder'}, {'id': 'tt11866324', 'name': 'Dakota Beavers'}, {'id': 'tt11866324', 'name': 'Dane DiLiegro'}, {'id': 'tt11866324', 'name': 'Stormee Kipp'}]"
